{"run_id":"7-plan-1-20260901T000000","issue":7,"stage":"plan","attempt":1,"outcome":"ok","harness":"claude","model":"claude-sonnet-5-5","cost_usd":0.5,"input_tokens":10,"output_tokens":5,"cache_read_tokens":0,"cache_write_tokens":0,"turns":2,"tool_calls":3,"wall_seconds":30,"started_at":"2026-09-01T00:00:00.000Z","ended_at":"2026-09-01T00:00:30.000Z","events_path":"runs/x/events.jsonl"}
